<!ELEMENT bookstore (book+)>
<!ELEMENT book (title, author, year, publisher, price)>
<!ATTLIST book category CDATA #REQUIRED>

<!ELEMENT title (#PCDATA)>
<!ELEMENT author (#PCDATA)>
<!ELEMENT year (#PCDATA)>
<!ELEMENT publisher (#PCDATA)>
<!ELEMENT price (#PCDATA)>
